{
  "apiVersion": "0.2",
  "kind": "HUD",
  "name": "SlateMissingMethodHUD",
  "viewModel": {
    "class": "VM_SkillBar",
    "methods": [
      {
        "name": "UseSkill"
      }
    ]
  },
  "root": {
    "id": "rootPanel",
    "type": "CanvasPanel",
    "children": [
      {
        "id": "slotQ",
        "type": "Button",
        "actions": [
          {
            "on": "Released",
            "do": {
              "callVM": "vm.UseSkill(0)"
            }
          },
          {
            "on": "Clicked",
            "do": {
              "callVM": "vm.UseSkill(0)"
            }
          }
        ]
      }
    ]
  }
}
