{
    "testSpec":  {
                     "target":  "WidgetMissingCooldownHUD",
                     "phases":  {
                                    "assert":  [
                                                   {
                                                       "assertVisible":  {
                                                                             "id":  "slotQ_cooldownBar",
                                                                             "expected":  true
                                                                         },
                                                       "step":  "bar visible"
                                                   }
                                               ]
                                }
                 },
    "name":  "WidgetMissingCooldownTest",
    "apiVersion":  "0.2",
    "kind":  "Test"
}

