{
  "apiVersion": "0.2",
  "kind": "Test",
  "name": "TimeoutArrangeTest",
  "testSpec": {
    "target": "TimeoutArrangeHUD",
    "phases": {
      "assert": [
        {
          "step": "wait ready badge",
          "waitForVisible": {
            "id": "readyBadge",
            "expected": true,
            "timeout": 1
          }
        }
      ]
    }
  }
}
