{
  "apiVersion": "0.2",
  "kind": "Test",
  "name": "TimeoutVisibilityTest",
  "testSpec": {
    "target": "TimeoutVisibilityHUD",
    "phases": {
      "assert": [
        {
          "step": "wait badge",
          "waitForVisible": {
            "id": "auraBadge",
            "expected": true,
            "timeout": 1
          }
        }
      ]
    }
  }
}
