{
    "root":  {
                 "id":  "rootPanel",
                 "type":  "CanvasPanel",
                 "children":  [
                                  {
                                      "id":  "slotQ",
                                      "type":  "Button"
                                  },
                                  {
                                      "content":  "Q",
                                      "id":  "slotQ_keybind",
                                      "type":  "TextBlock"
                                  }
                              ]
             },
    "name":  "WidgetMissingKeybindHUD",
    "apiVersion":  "0.2",
    "kind":  "HUD"
}

