{
    "testSpec":  {
                     "target":  "WidgetMissingAuraHUD",
                     "phases":  {
                                    "assert":  [
                                                   {
                                                       "assertVisible":  {
                                                                             "id":  "auraBadge",
                                                                             "expected":  true
                                                                         },
                                                       "step":  "badge visible"
                                                   }
                                               ]
                                }
                 },
    "name":  "WidgetMissingAuraTest",
    "apiVersion":  "0.2",
    "kind":  "Test"
}

