{
  "apiVersion": "0.2",
  "kind": "Test",
  "name": "SlateSignalTest",
  "testSpec": {
    "target": "SlateSignalHUD",
    "phases": {
      "act": [
        {
          "step": "click slot",
          "click": "slotQ"
        }
      ],
      "assert": [
        {
          "step": "slot remains visible",
          "assertVisible": {
            "id": "slotQ",
            "expected": true
          }
        }
      ]
    }
  }
}
